author,downs,score,selftext,subreddit,title,ups,upvote_ratio
Pyros111,0.0,771.0,,Catholicism,"750 years ago, Louis IX died before the walls of Tunis, during his second crusade. Few days ago I was able to visit Saint-Louis-des-Français in Rome, where this fresco of his death can be seen. Saint Louis, give us your zeal in the service of God, and help France to serve Christianity as it once did",771.0,0.99
PicoInAPool,0.0,766.0,,Catholicism,"The number of adult baptisms in Belgium has been in a continuous rise for the past decade: 143 in 2010, 180 in 2015 and 300 this year",766.0,0.99
TexanLoneStar,0.0,773.0,,Catholicism,"Today is the Feast of King David. Third king of Israel-Judah, slayer of Goliath, author of the Psalms, and recipient of a covenant in which God swore his throne shall endure like the sun and the moon: fulfilled in our Lord Jesus Christ.",773.0,0.96
aidanelm,0.0,774.0,,Catholicism,"[Free Friday] Singer Andrea Bocelli released his new album, ""Believe,"" today, which focuses on Catholic theological virtues.",774.0,0.98
PuzzleGuard,0.0,774.0,,Catholicism,"Today, Oct 21st, is the feast day of Blessed Charles I. Last Emperor of Austria, King of Hungary, King of Bohemia, and King of Croatia. He died on April 1, 1922 and was beautified by Pope John Paul II in 2004.",774.0,0.96
jedivader,0.0,770.0,,Catholicism,Today we celebrate Our Lady of the Rosary and the defeat of the Ottoman empire in 1571 against overwhelming odds thanks to the intercession of Our Blessed Mother.,770.0,0.98
drocki123456,0.0,769.0,Praise be to God!,Catholicism,"After 5 months, I went to Confession and have been absolved of my sins!",769.0,0.98
f_idk_sure,0.0,770.0,,Catholicism,"Christmas gifts from the in-laws, they do know me",770.0,0.98
Mr_Sloth10,0.0,762.0,"You guys have been dealing with my ""my wife and I"" posts for a while, but I wanted you to know it wasn't for nothing!

By the Grace of God, we were brought home and we received our Lord in Holy Communion for the first time! It was such an incredible moment to finally be one with the Church of Christ.

You guys have helped me a lot on this journey, so it only seems right to let you guys know that all the effort you put into answering my questions did bear fruit, and I want to say thank you.

May God Bless you all",Catholicism,"A year ago, I was a Baptist asking this subreddit questions about the Catholic faith. Yesterday, my wife and I were Confirmed into the Church!",762.0,0.98
[deleted],0.0,765.0,,Catholicism,Pope 'pained' by Hagia Sophia mosque decision,765.0,0.99
you_know_what_you,0.0,763.0,,Catholicism,"THE VISITATION — July 2 (EF calendar). “We must here consider that the greater cometh unto the lesser, Mary unto Elizabeth, Christ unto John. … Elizabeth was the first to hear the voice of Mary's salutation, but John was the first to receive grace. She heard naturally, but he leaped mystically.”",763.0,0.99
Brelen_Raven,0.0,769.0,"His name was Mike.

I got his name as my middle name, Michael. I guess I'll always have that, eh?

Thanks, everybody.",Catholicism,If you guys could pray for the repose of the soul of my grandpa that'd be cool. He died a few hours ago,769.0,0.99
FreshEyesInc,0.0,768.0,,Catholicism,"[Free Friday] Proudest Dad Moment Ever! On His Own Volition, My 2y/o Son Asked My Wife To Pray With Him",768.0,0.95
[deleted],0.0,759.0,,Catholicism,"Thanks to all your prayers! Super Typhoon Goli caused less damage and casualties than anticipated. Let us continue praying for hundreds of thousands of families that were displaced by the typhoon in the Philippines. (Photo: Evacuees at the Pilar Parish, praying the rosary)",759.0,0.99
michaelmalak,0.0,763.0,,Catholicism,How incense at Mass can reduce airborne diseases: Both science and history of Church practice confirm the purifying ability of burning frankincense during religious services,763.0,0.97
[deleted],0.0,758.0,,Catholicism,55% of young adults say faith helped them during Covid-19 crisis - Catholicireland.net,758.0,0.96
NoiselessDick,0.0,760.0,,Catholicism,"Protestant here, thrifted a copy of this classic book I had vaguely heard of. Turns out I’m slowly becoming Catholic",760.0,0.99
zippozebra,0.0,751.0,,Catholicism,"Happy Free Friday New Year! Our little Jonathan Ambrose was baptized recently. Welcome to the church, little Saint, Jesus loves you! Please pray for me and my wife as we strive to raise our children to know, love, and serve God.",751.0,0.97
Quirky-Capital,0.0,760.0,,Catholicism,"Today, Oct 1st, is the feast of St. Thérèse of Lisieux of the Child Jesus and the Holy Face, ""The Little Flower"", youngest of all Doctors of the Church, one of four women Doctors of the Church, Discalced Carmelite Nun, Patron Saint of Missionaries",760.0,0.98
oneleo873,0.0,753.0,,Catholicism,Post your church ! This the inside of my Byzantine Catholic (Ruthenian) church. I love seeing the inside of other churches!,753.0,0.98
Spartan615,0.0,747.0,,Catholicism,Vatican Rejects Gender Fluidity in New Catechetical Text,747.0,0.95
SugarEarly,0.0,754.0,"I read some time ago in the mainstream media that the Chinese state/government was rewriting the Bible (and Qur'an), this is the first time I'm hearing about a specific example.  

I saw this posted on twitter. I'm not familiar with the sources of this news, so if it's wrong,sorry, if someone knows a source they trust or that we know better, that would be good.

I'm not sure if they are printing new Bibles with this or printing it in a school textbooks only, I think this is about textbooks, but they have changed the Gospel, they are teaching that Jesus stoned the woman to death !! instead of what we know that He stopped her being stoned and let her go to sin no more. 

And they have changed it to say that He said ""I too am a sinner. But if the law could only be executed by men without blemish, the law would be dead"".!

https://bitterwinter.org/ccp-rewriting-the-gospel-jesus-actually-killed-the-woman-taken-in-adultery/

https://www.ucanews.com/news/chinese-catholics-angry-over-book-claiming-jesus-killed-sinner/89619#

Don't know if this was already posted here",Catholicism,"Chinese Christians angry. Chinese State authorities change Bible story to say: 'When the crowd disappeared, Jesus stoned the sinner to death saying, ""I too am a sinner. But if the law could only be executed by men without blemish, the law would be dead,""",754.0,0.98
83829573,0.0,751.0,,Catholicism,"Catholic Churches Across The Country Burned, Vandalized Over The Weekend",751.0,0.96
Jnip9090,0.0,745.0,,Catholicism,[FREE FRIDAY] Tomorrow will be beatification of Carlo Acutis 🙏,745.0,0.99
ZYVX1,0.0,749.0,,Catholicism,"April 19th is the Feast Day of Saint Expeditus: Armenio-Roman Centurion. Christian convert from Paganism, he was a Martyr of the great persecution of Christians done by Emperor Dioclesyan, after he started preaching to Gospel to his troops and protecting other Christians from Persecution (303 A.D.)",749.0,0.99
Seethi110,0.0,743.0,"I hope nobody here will judge me or say i'm going to Hell, but I figured this is the best place to put down my thoughts.  I appreciate the prayers, but I don't think that will change anything right now.

\-

A few weeks ago, I stopped going to Mass.  Not because I wanted to or because I've given up the faith, but because our Bishop suspended Masses until further notice.

\-

&amp;#x200B;

&amp;#x200B;

&amp;#x200B;

&amp;#x200B;

Happy April Fool's ;)",Catholicism,Why I stopped going to Mass,743.0,0.95
normalman_obscureman,0.0,743.0,,Catholicism,"Pope Francis spoke about Asia Bibi the Pakistani Catholic who was imprisoned for 9 years for blasphemy against Islam, Calling her a victim of the devil's rage saying: ""Where there is rage, there is hatred, the revenge of the devil is unleashed.""",743.0,0.97
bartleybranson,0.0,738.0,"I’m so angry and sad. Please pray for St. Elizabeth of the Hill Country in Boone NC. :( 

Someone broke in through a window. It happened sometime between 9pm last night and 9am this morning. A police report was filed. That’s all I know right now, but please pray and offer reparation for the desecration of the church and the theft of the Blessed Sacrament!

EDIT: The tabernacle is made of yellow brass, not gold, but there’s no way the thieves would have known that beforehand. I also want to make it clear that my concern is not for the tabernacle itself, but for the stolen Eucharist. 

Thanks for all the support! Your prayers (and efforts against the trolls) are greatly appreciated. I hope everyone has a blessed week.",Catholicism,Our tabernacle was stolen from our church last night,738.0,0.97
anonfoyou,0.0,744.0,I know it was a meme a while ago but I feel that this is an important matter that people should know about,Catholicism,Please capitalize the G in God,744.0,0.91
AloneBowl,0.0,744.0,"Hello r/Catholicism, some of you may remember me from 2 years ago although I'm sure most of you don't. I used this throwaway exclusively for expressing my deep marital troubles and asking for prayer support from the faithful members of this sub. The entire story is way too long to post, but feel free to look at my post history to get a glimpse into that time two years ago.

I'm back to give you all an update because I think you deserve it. Everyone on this sub was so kind to me and offered me so much love and prayer during my ""dark night of the soul"". I'm going to apologize in advance because I'm sure this is going to be long; a lot has transpired since my last post. I'll do my best to summarize though.

For a while things got worse, and worse and living with my spouse was becoming unbearable. I loved him so much and he just kept pulling further and further away from me. One day I couldn't take it anymore. I couldn't keep fighting against it. I felt so lost and hopeless and like God had abandoned me in my deepest need. I was clinging to the Blessed Virgin. On this particular day I prayed ""Mother, I can't keep doing this. I don't want to give up on my marriage but I also don't want to keep fighting for something that God hasn't meant for me. I need to know what I'm supposed to do. If I'm meant to keep praying and hoping to save my family I will, but if I'm meant to accept that this is God's will and start praying to get through all of this I will do that to. Please, send me a sign, but Mother, it has to be clear. It has to smack me in the face because if it's anything less I'll convince myself I imagined it."" Afterwards I prayed the rosary and left it in her hands. Later that day I started to get myself ready for mass and as I bent to get my hair curler from below the sink something flew out of the cabinet and literally hit me in the face. When I went to see what had just attacked me I saw that it was an engagement photo of my husband and I (I have no explanation for how or why that photo was in there). ""Okay, Mom. I read you loud and clear"" I promised Our Lady that because she gave me this sign I would pray for our marriage up until the moment when I received an annulment.

I had a clear hope to cling to and I took absolutely everything to the Blessed Mother and asked for her to intercede for me; reminding her of the Wedding Feast at Cana and that perhaps the only reason I would receive a miracle was because she asked it of Our Lord. However, things didn't look up. My husband moved out of our house later that month and I was in utter despair and desperation as we continued to move through the divorce process. I kept my promise to pray for my marriage but it didn't seem to be helping.

As sad and alone as I was soon separation became my ""new normal"". We co-parented well and got along okay but there was still so much pain. I was still so in love with him and we were still each others best friend. I tried seeing someone else but it made my hurt worse. I kept praying for our marriage but in October of 2019 we signed the final divorce papers and I began the process of annulment. I often wondered how I had gotten it so wrong. How on earth had I misinterpreted that sign? Feeling much less optimistic I continued to pray for our marriage because I promised Our Lady I would.

Jumping ahead to December of 2019 my (now ex) husband came to me crying that he missed me, he missed our family, he had made so many mistakes, etc. I was hopeful but cautious. I immediately made my priest aware of the situation and sought his council and advice. He was so helpful to me and understanding of my situation (he himself coming from divorced parents). Eventually I halted the annulment process for the time being.

We went through a lot of turmoil trying to reconcile and heal and trust each other. It was hard and somedays seemed absolutely impossible. Then the quarantine happened and we agreed that it would be best for my husband to come be quarantined at my house so that he could still see our daughter. I thought this time would make or break us. We went through so much external stress during that time (as was the rest of the world, I know). Lots of ups and downs, but one night we laid it all out on the table. Everything we'd done in the separation that we had been avoiding talking about, all our feelings, hopes, and needs and from that point everything completely shifted.

From that night onward our relationship became totally different. We were our old selves but better. Our communication is 1000x's better, we both sought treatment for mental health and physical health issues, we became more accepting and mature. We are now 6 months from that point and things have never been better. We just recently told our family members that we have reconciled and everyone on both sides is over joyed!

I just wanted to publicly thank Jesus for his tender Mercy to our family, Our Lady whom I give full credit to in getting us here and helping me maintain my hope, sanity, and faith in a time where I had every reason to lose all three, to the communion of saints whom I called on for so much help, and to everyone (especially this community) who offered prayers for us. Miracles do happen!

May anyone who is in pain or despair right now surrender themselves to the love of Jesus and Mary. God bless and keep you all, and have a Merry Christmas.",Catholicism,My Marriage is in Jeopardy: Update,744.0,0.99
mujwa,0.0,744.0,,Catholicism,8th of September. The feast of The Nativity of the Blessed Virgin Mary,744.0,0.99
TexanLoneStar,0.0,738.0,,Catholicism,Fr. Don Giuseppe Berardelli passes away after giving his respirator to a younger patient.,738.0,0.99
rule_supreme,0.0,741.0,"Hey all,

Lashing out at those who had an abortion/pro-choicers will not do anything at all; it will only make them despise the pro life movement even more.

Instead, we need to use scientific facts, reveal how disgusting abortion is (show pictures of abortion babies to reveal the truth behind abortion) but most importantly: 

Offer love and forgiveness.

Forgiveness shows compassion, and it is definitely a very effective way of convincing pro choicers to change their minds. Forgiving is also integral in our catholic faith so we should forgive and offer kindness no matter now abhorrent the sin is.

That’s it y’all, I’d like to know your thoughts and responses :)",Catholicism,Love and forgiveness must be an integral part of the “pro life” movement,741.0,0.93
queenshortcoming,0.0,740.0,,Catholicism,"[Free Friday] I love all respectful images of the Blessed Virgin, but especially ones of her and Jesus with darker complexions. So I painted one myself!",740.0,0.95
NoTrueScotist,0.0,736.0,,Catholicism,"On April 1st, 1922, Blessed Karl von Habsburg-Lothringen (the last reigning Emperor of Austria and Apostolic King of Hungary) died in exile on Madeira, aged 34.",736.0,0.97
TexanLoneStar,0.0,735.0,,Catholicism,[Free Friday] Friend reminder: stay away from coomer culture.,735.0,0.9
NordyNed,0.0,737.0,,Catholicism,"100 Years Ago Today [September 23, 1920] Construction begins on the Basilica of the National Shrine of the Immaculate Conception in Washington, DC, the largest Catholic church building in America. The ceremony is viewed by 10,000 people.",737.0,0.98
spaceyjdjames,0.0,738.0,,Catholicism,"St. Hubert, Pray for Us!",738.0,0.99
Nobre_Patriota,0.0,733.0,,Catholicism,[Free Friday] Saint Joseph,733.0,0.98
krystalynexe,0.0,735.0,"So, I’m fairly new to the Catholic faith (converting from Baptist) and I have my first RCIA class Tuesday (freshman in uni). Today, I went to the freshman retreat and we had adoration. Today was the FIRST time I’ve ever seen the Eucharist and I literally cried. I was on my knees literally thinking this is literally Jesus right here in front of me. Best night ever, met some great people who are now my mass and bible study mates!",Catholicism,Wow. Just wow.,735.0,0.96
The_Bird_King,0.0,732.0,"I'm a pastor at a Baptist Church and I've been thinking about converting the past few months. I posted here before about going to mass for the first time.

I was reading a book called ""Catholics and Protestants, what can we learn from each other"" and I was thinking "" there really isn't any reason why Protestants don't ask Mary and the saints to intercede on their prayers, we just don't do it just because"" and I'm starting to think this might not be the only thing we don't do "" just because"". So I went for it and asked for her to guide me towards the direction Jesus wants me to go in. I was pretty hesitant to start it, I don't know why I got nervous lol. I'm looking forward to seeing where this journey takes me and I have been learning a lot along the way.",Catholicism,I prayed my first Hail Mary today,732.0,0.99
russiabot1776,0.0,733.0,,Catholicism,[Free Friday] 88-yr-old Cardinal Zen of Hong Kong takes in St. Peter's Square one last time: He flew to the Vatican to urge the end of the Chinese appeasement policy but was refused an audience,733.0,0.98
Melchezedek57117,0.0,733.0,"The very fact ’Cuties’ is allowed to even exist on a media platform is absolutely astonishing to me. To see people actually praising this abomination is horrifying and frightens me to a point I’d never thought I’d feel. Think about all the takes, pictures, film of the children ’auditioning‘ for this film, the revealing and disgusting things they did. And others praise it? What the hell is there to praise? My opinion? Anyone who speaks in defense of this film should be put on a list.

Folks, I’d be more than willing to start a novena just for this occasion. Anyone want to join?

EDIT: The very fact I had to defend my position more than once is mind numbing. This isn’t a grey area. This is more black and white than ever before. You’re for it or against it. You’re for children being exploited or against it. I swear, sometimes I feel like I’m talking to a brick wall. And yes I’m passionate about this.",Catholicism,This is not normal. Nothing about this is remotely normal.,733.0,0.95
YouAreWho202,0.0,728.0,"Another subreddit made a post about my post and used it as a way to attack this subreddit and I am deeply sorry. 

I am a pawn of no one. They should never use me as an excuse to attack the church which I care deeply for.  I am a Catholic American who called out to other Catholics for help. This subreddit is the kindest and most amazing place I’ve ever seen. I want to thank all of you here for your support over all the times I have made a post here. I am never turning away from the faith. God loves me and will help me get through anything. God bless you all.",Catholicism,I made a post about my sexuality and it kinda blew up...,728.0,0.97
augustv123,0.0,732.0,,Catholicism,Today is the feast of Our Lady of Walsingham,732.0,0.99
Defense-of-Sanity,0.0,729.0,,Catholicism,Did Jesus have blood siblings?,729.0,0.98
qi1,0.0,734.0,,Catholicism,Hundreds of Catholics sing hymns and protest ban of public Mass in France,734.0,0.95
cathgirl379,0.0,735.0,,Catholicism,"[Free Friday] My Third Order Discalced Carmelite habit is completed! I plan on using it for the local Renaissance Festival as subtle evangelization. The hardest part was the white wimple, everything else was straightforward :D (the point in the veil is a nod to St. Therese)",735.0,0.98
Deadeye_ND,0.0,735.0,,Catholicism,Prominent American Catholic Philip Rivers chooses to retire from NFL on St. Sebatian's Day,735.0,0.97
astroturd312,0.0,729.0,,Catholicism,"Today is the feast day of St Maron, a 4th century hermit and the founder of the Maronite rite of the Catholic",729.0,0.98
tastypasta18,0.0,731.0,,Catholicism,Argentine boy saved from stray bullet by crucifix,731.0,0.99
PerthMountPeasant,0.0,727.0,,Catholicism,"My front door prepared for Palm Sunday. Not something I have ever done before, but in lieu of not being able to attend Palm Sunday Mass. Hosanna in the highest! Have a blessed Holy Week.",727.0,0.97
TT1775,0.0,727.0,"I started saying a daily rosary a few weeks ago and just... temptation is mostly gone. I wouldn't even say I'm praying fervently; I usually pray a decade at a time throughout the day and sometimes struggle to meditate on the mysteries. Nevertheless, I typically don't think of porn anymore and the couple of times I've watched it in the last few weeks the reaction has been ""...meh"". No more animalistic lust.

 What gives?  Any similar experiences?",Catholicism,Guys I Think the Rosary Works,727.0,0.97
SpiceSeagull,0.0,725.0,couldn’t think of a better place to share this but i’m just very excited about this progress for prolife,Catholicism,my state just ended dismemberment abortion,725.0,0.88
scottsmith81,0.0,724.0,,Catholicism,St. Januarius' blood liquified in Naples this morning! Today is his feast day and this event happens almost every year on his feast day. Miracles are happening all around us!!,724.0,0.98
Rafael_11,0.0,726.0,,Catholicism,"Today is the feast day of St. Gemma Galgani, ""Daughter of the Passion""",726.0,0.99
[deleted],0.0,722.0,,Catholicism,"Popular, Openly Gay YouTuber “Lohanthony” Is Now A Celibate Practicing Catholic!",722.0,0.92
NoTrueScotist,0.0,722.0,,Catholicism,"March 17th is the feast of Saint Patrick, “the Apostle of Ireland”: Romano-British nobleman, mystic, Lerinian priest-monk, missionary to the Gaels, itinerant preacher, wonderworker, founding Bishop of Ard Macha, and hymnographer—who died on this day in AD 493.",722.0,0.99
Jnip9090,0.0,717.0,,Catholicism,Pope Francis talking about Word of God,717.0,0.97
caballitodetequila,0.0,725.0,,Catholicism,"Spain, tortured and killed by red communist terror, 1936. Catholic persecution was the daily bread in the civil war. 13 spanish bishops. Martyrs of the Holy and only church! Ora pro nobis",725.0,0.96
TheMadTargaryen,0.0,714.0,"&amp;#x200B;

https://preview.redd.it/48al2aiwdv751.png?width=1024&amp;format=png&amp;auto=webp&amp;s=8900d79d7d474105d342eb09b1656da18f5a0d7b",Catholicism,"11 new priests were ordained at 29.06.2020 at the Sacred Heart cathedral in Sarajevo, Bosnia and three more in cathedral of Mostar in same country. Pray for them.",714.0,0.99
da_drifter0912,0.0,717.0,,Catholicism,Cardinal Pell’s Conviction is Overturned,717.0,0.93
TexanLoneStar,0.0,715.0,,Catholicism,Today is the Exaltation of the Holy Cross. A feast that venerates the actual cross that Christ was sacrificed on. Found by the mother of Saint Emperor Constantine in Jerusalem the Church of the Holy Sepulcher was built upon it and dedicated on this day in 335 A.D.,715.0,0.99
bleakmonday,0.0,717.0,"I am an 18 years old girl, coming from a muslim family. Both my parents are conservative muslims. One day, they opened my phone and they found my youtube history, where i searched videos about catholicism. 

After all of us prayed together (which I, of course, didnt do willingly), they talked to me about it. They said, if I actually convert, they will disown me as their kid, force me to move out of the house, and won't pay for my college tuitions. Both my parents are toxic and abusive, so I kinda expected them to get angry at me, but they did not even sound angry. They spoke flatly, which sounded like they're disappointed at me.

I plan to cut the relationship between me and them once i get independent, but i dont know if that is a good thing to do, since it's not very common in this country. I just... dont have the guts to do that. I still love them. 

This thing makes me so depressed. I can't even pray at peace. Please give me your advices, and kindly pray for me. God bless you all.",Catholicism,"I really want to convert and be a catholic, but my family will disown me if I do so.",717.0,0.96
mcm9ssi9,0.0,711.0,,Catholicism,"Le 9 decembre, on celebra St. Juan Diego Cuauhtlatoatzain; sancto native american qui es in le origine del devotion al Virgine de Guadalupe, sancte patrona del Mexico e America.",711.0,0.98
TexanLoneStar,0.0,713.0,,Catholicism,Today we celebrate Pope Saint Leo the Great. Elected Pope in 440 A.D. he was a stalwart defender of the doctrines of Papal Supremacy and Dyophysitism as well as the city of Rome from Attila the Hun in 452 and the Vandals in 455.,713.0,0.99
