author,downs,score,selftext,subreddit,title,ups,upvote_ratio
[deleted],0.0,433.0,"I went to Mass after a long time today. I stopped making excuses. Our small church was filled with 20-30 people. I really liked attending Mass. Me and my girlfriend will go every Sunday from now on. I can’t wait to be able to take the Eucharist!

Edit: Thanks for the awards!",Catholicism,I went to Mass today,433.0,0.98
feb914,0.0,435.0,"Yesterday morning I listened to a couple of podcast episodes by Fr Mike Schmitz about going to confession, especially about mortal sin. I haven't done any confession since lockdown and have committed some mortal sins since then, so I felt that this is my calling to go to confession.  

However, my parish was relatively small and there haven't been any confession even though public masses have been made available for the past 1.5 months-ish. Before lockdown there weren't many people going to confession (if there's any) so it didn't surprise me that the priest didn't hold it since he felt there's no demand.  

So I went to church slightly early yesterday (I go to mass on saturdays because my sibling and I are part of choir for that mass) with intention to ask for confession. But I felt quite shy to ask and not sure if the priest would be around early. Turns out when I came in, there were 3 ladies who're asking the priest for confession, so he held an impromptu one in his office (with 2m distancing and mask). I felt that God opened the way for me to do confession. However, there's even more miraculous thing.  

Few minutes later, came a relatively young man who I never saw in the parish, then he asked if there's a confession happening. I told him where the line up is and asked whether he usually go to this parish. He said no, he usually go elsewhere, but he's around the area and felt sudden urge to do confession. Had he come any other weekend, or even half an hour earlier or later, he would have missed the first confession our parish did in the past 4 or so months. For me that's a small miracle.  

Even the priest commented to me that his first time opening confession up in 4 months and there's a lineup. Hope this encourages him to start the weekly confession again.

God opens the way for those who want to reconcile with Him, so we shouldn't feel shy or afraid to confess our sins. He's waiting for us to come to Him, and if we intend it, He'd make a way.",Catholicism,A small miracle about confession I experienced yesterday,435.0,0.99
Empty-Fox9134,0.0,430.0,"This is probably the funniest story that my parents have ever told me, and i thought that I'd share it with all of you guys here on my favorite subreddit.

My mother and father were a young couple at the time of this event, and were on vacation in a major city as a reward for the fact that they had both just graduated from  college. My mother, being a history major, wanted to stop into a museum nearby, and my dad concurred after seeing that they had some special exhibition about eother coca cola or star wars. 
Anywho, they pay their admission, walk around this renound museum until they come across the Catholic Arts room. They wander in and it's the usual scene- lots of kids in Catholic school uniforms flocking around, depictions of saints and Jesus everywhere,  and of course and abundance of visitors. They're just standing around, admiring everything, when the woman in front of them said to her daughter- ""the Catholic church really doesn't like educating people."" 

My mother is so infuriated she can't speak. But my father, maybe driven by spite, the holy spirit, or both, tapped her on the shoulder. ""Ma'am, I'm Catholic,""

""And?"" 
""So's my girlfriend. We're graduates of Yale,"" 
""And what are you saying exactly?"" as the woman sneered this, her daughter was staring up at my dad all confused but semi intrigued.

""You just said, in a room full of Catholic school children who were in a gallery devoted to Catholic Academia, next to 2 catholic Yale graduates, that the church discourages people from getting educated. Now are you SURE that that's the hill you want to die on?"" 

It's with this that the woman drags her daughter away. My mom was laughing like a seal by now, and my dad followed suite. They had to leave the place And go back to their hôtel. Where later that night, my father proposed. 

And this is the story they tell us whenever they're feeling sappy, or want to encourage us in our faith. It's by far my favorite and i wanted to share it with you :)",Catholicism,"""Catholics aren't educated!""",430.0,0.98
Skullbone211,0.0,436.0,,Catholicism,"[Free Friday] One of my favorite paintings, ""The Parents of the Celebrant after his First Mass"", José Alcázar Tejedor, 1887",436.0,1.0
simple_cathconvert,0.0,436.0,,Catholicism,[Free Friday] after 2 years without drawing due to mental illness I tried again this time the Holy Family. I know the eyes are weird i need practice again,436.0,0.98
Nobre_Patriota,0.0,430.0,,Catholicism,"Today is the feast day of Our Lady of Aparecida, Patroness and Queen of Brazil, the largest catholic country in the world.",430.0,0.99
LegatusMaximus,0.0,434.0,,Catholicism,"Blessed feast of St. Francis of Assisi! In honour of the feast day, here is an icon I drew of him for my bedside table (since he is my patron saint). I thought the subreddit may like it!",434.0,0.99
[deleted],0.0,430.0,"The often overlooked silent protector of Mary and Jesus means a lot to me now that I’m a father.

Last December, Bishop Burbidge visited our parish and gave a good homily on St. Joseph and what it meant to be a “just man.” I told the Bishop afterward how much it hit home for me since my wife was pregnant at the time and he gave a nice blessing to us.

Taylor Marshall and Kennedy Hall did an episode last week on St. Joseph. Last month Church Militant interviewed Father Donald Calloway on his book, “Consecration to St. Joseph: The Wonders of Our Spiritual Father.” Which I totally recommend. Faith Goldy endorsed praying a novena to him as well a few months back.

In hard times trying to balance being a holy father, husband and good employee, I’ve often been turning to St. Joseph in prayers. 

Plus he’s the “Terror of Demons” which is the most badass moniker.

I’d recommend to everyone on this sub to pray the novena to St. Joseph. I’ve attached a link below.

PS: I hope this thread doesn’t end up on the brain trust that is r/religiousfruitcakes like my last post. 🙄

http://www.catholictradition.org/Joseph/joseph28.htm",Catholicism,Happy to see that St. Joseph is getting more recognition,430.0,0.98
Mindless-Equal,0.0,431.0,"An unexpected, but welcome, benefit of trying to be closer to God",Catholicism,Learning more about Catholicism and reading the Bible made me better at Jeopardy,431.0,0.99
Im_A_Potato521,0.0,432.0,,Catholicism,"Today is the feast of St. Rita of Cascia- mother, wife, widow, and nun she is know as patron of difficult and impossible cases. Just finished her novena today, St Rita pray for us!",432.0,0.99
bspc77,0.0,433.0,"I like metal and hard rock with the exceptions of bands that diss God or worship the devil (ie Lamb of God or Godsmack), but I love me some Metallica and such. I haven't met anyone who likes metal and hard rock but won't listen to some of it based on morals. Any other Catholics out there who are in the same boat as me? What are your favorite bands and what bands will you not listen to?

Edit: the bands don't have to necessarily be Christian, just not anti-Christian or blasphemous

Edit: you guys are awesome. Based on irl Catholics views I've heard I was a little worried I'd get bashed on here but instead I found like minded people and some great music recommendations! Rock on guys",Catholicism,Any other Catholic metal heads out there?,433.0,0.96
CrTigerHiddenAvocado,0.0,431.0,,Catholicism,Hope and Healing: Project Rachel Provides Post-Abortive Support to Women and Men,431.0,0.98
[deleted],0.0,433.0,"[https://www.catholicnewsagency.com/news/us-hosts-signing-of-declaration-rejecting-human-right-to-abortion-28491](https://www.catholicnewsagency.com/news/us-hosts-signing-of-declaration-rejecting-human-right-to-abortion-28491)

[https://www.youtube.com/watch?v=rRPuJVOzJz8](https://www.youtube.com/watch?v=rRPuJVOzJz8)

Praise to the LORD !",Catholicism,US hosts signing of declaration rejecting human right to abortion,433.0,0.88
TexanLoneStar,0.0,426.0,,Catholicism,"Holy Mass of Palm Sunday. Celebrated by Pope Francis at St. Peter's Basilica, Vatican. - April 5th, 2020.",426.0,0.99
TheEpicBoss95,0.0,427.0,"I prayed the rosary for her, but I feel so powerless to do anything. I know her through online only and have no way to contact anyone who might know where she is or know her IRL.

EDIT: In regards to people saying to contact the police, I'm not sure if can help because she lives in a third world country

EDIT 2: Thank you all for your prayers. She's still in a rough spot but it's better than it was at the time of this post",Catholicism,Please pray for my friend. She's planning on killing herself within the next few days,427.0,0.97
manicwoodswoman,0.0,427.0,"Several days ago, I made a post on this sub expressing how I wanted to go back to church after years of being a bad person, but was scared to tell my mother, who is catholic. The post is [here](https://www.reddit.com/r/Catholicism/comments/ir8q9z/what_do_i_do/?utm_source=share&amp;utm_medium=ios_app&amp;utm_name=iossmf) 

I talked with her about it shortly after I made that post, and she said she would love to go to church with me. She seemed very surprised but happy. I am so grateful that she is a gracious person and did not interrogate me as to why I’ve had a change of heart after all these years. 

I just wanted to say thank you to you guys! I never would have had the courage to tell her if people on this sub wouldn’t have encouraged me to and assured me that God would still accept me. It’s amazing to me that internet strangers cared that much.",Catholicism,Update: you guys were right!,427.0,0.99
Trad_Cat,0.0,428.0,,Catholicism,The Plan of the Mass Diagram — From Antique St. Joseph Daily Missal Circa 1950 I got for Christmas,428.0,1.0
PM_ME_AWESOME_SONGS,0.0,422.0,,Catholicism,"With the date approaching, this is a reminder that Christmas IS NOT derived from a pagan holiday",422.0,0.98
Caliph_Vathek,0.0,426.0,,Catholicism,[Free Friday] St. Benedict Cross blessed by Pope Francis,426.0,0.98
Falandorn,0.0,427.0,"This was really embarrassing did this ever happen to anyone? I went to confession just now, no one in the queue so went right in as lights were on. Forgive me Father for I have sinned it's been so many weeks since...et cetera Father really quiet tonight...


Silence...after a while I started peering through grill and no-one was in there, confessing to an empty booth 😅",Catholicism,God was AFK,427.0,0.99
TexanLoneStar,0.0,421.0,,Catholicism,"Today is the Memorial of St. Cyril of Jerusalem (315 - 386), bishop of Jerusalem and Doctor of the Church. His writings of ""Catecheses"" faithfully defended orthodox doctrines, most notably the Eucharist and baptism, as well as expounded the Scripture and Apostolic Tradition.",421.0,0.99
JackPECIH,0.0,426.0,"Man was created for a certain end. This end is to praise, to reverence and to serve the Lord his God and by this means to arrive at eternal salvation

— St. Ignatius of Loyola

from The Spiritual Exercises",Catholicism,Man's End,426.0,0.97
charlelouise,0.0,424.0,,Catholicism,[Free Friday] Some rosaries I made recently. Slowly becoming obsessed with making them😅,424.0,0.97
Didieverreallymatter,0.0,418.0,"

After going through some really difficult times when I was around 17, I lost my faith and stopped attending church. I still prayed the rosary simply because I have always found it calming and meditative, but that was about the extent of it. 

Recently my husband and I had our second child, a son, and he was born tiny and somewhat sick. Shortly afterwards I nearly died of an infection and post partum haemorrhage and required surgery and blood transfusions. 

Haemorrhaging was awful, and I quite genuinely thought that it could be the end for me. It’s difficult to remember, but one of my main thoughts at the time was just to pray. I was terrified, and I just remember praying that God would help me to live for my children and my husband, and that if I didn’t make it, to please protect them and keep them safe when I was gone. 

Today I took my son to Mass for the first time and thought about that moment a lot. I am so grateful to still be here and thank God every day for the opportunity to watch my children grow up, and to help them have their own faith. 

I’m sorry for the long post, but I guess I just wanted to say, it’s never to late to ask for help and to be welcomed back.",Catholicism,I went to Mass today for the first time in 5 years!,418.0,1.0
Jnip9090,0.0,421.0,,Catholicism,"[FREE FRIDAY] Blessed Mother, Queen of peace, pray for us sinners.",421.0,0.99
PhantasmPhred,0.0,423.0,"Brothers and Sisters,

Today is Divine Mercy Sunday!   


We can obtain the promises of the Devine Mercy devotion by simply making an Act of Contrition and Spiritual Communion with a firm resolution to avail ourselves to Sacramental Confession and Eucharist at the earliest opportunity!

Our Lord told St. Faustina that “The soul that will go to Confession and receive Holy Communion **shall obtain complete forgiveness of sins and punishment**. On that day all the divine floodgates through which graces flow are opened. Let no soul fear to draw near to Me, even though its sins be as scarlet (699).”

I have read this to be understood as being akin a second baptism. 

This is a wonderful opportunity to turn back the clock on our wretched past, Glory to God in the Highest!",Catholicism,Happy Divine Mercy Sunday! Christ is Lord and King! Alleluia!,423.0,0.99
bittnerator,0.0,421.0,"(Reposted after advice from mods)

Yesterday at mass my priest gave a very powerful homily that I absolutely did not expect.

He first quoted Cardinal George about how his successors will be persecuted then martyred and then rebuild society. He very bluntly stated that we are living in dark times, have been for some time, and that this transcends politics and goes beyond (in America) Republican or Democrat, conservative or liberal, and even secular and religious. We are at a point where governments and corporations pose a direct threat to human rights, freedom, the ability to speak Truth, and how it is the Church's responsibility to uphold these things wherever she may be.

He then went on to describe that regardless of your opinion of the election or of politics, Joe Biden will be the next President. Whether or not you like this or think this it is legitimate, it is our duty as Catholics to pray for him as he leads our country.

That said, he stately bluntly that Biden has endorsed policies that are contrary to Catholic teaching (ie abortion) and in doing so has caused scandal as a self proclaimed Catholic. Because of this, my priest stated that if Biden were to come to this parish and attempt to receive communion, he would deny him as any good priest should in accordance with Church teaching. As Catholics we must encourage each other to abide by the Church even for, and especially for, our leaders.

He then finished by referencing the Cristero War in Mexico and the martyrdom that occurred. We should all live so that our last words may be ""Viva Cristo Rey!""

While there were plenty of people who seemed moved by this homily, an older women in her 60s came to him after mass and yelled at him. She said to him that ""Trump was worse, that the Church's teachings on abortion are years old and should be updated, that the Church has no right telling people what to do and is about acceptance, and that homilies like this are why less people come to Church"". My priest was very polite in responding and correcting each of these statements and stood by his words.

We frequently see posts of Church leaders acting scandalous on this subreddit, so I thought I'd share this story on here to show that we still have priests acting with courage and standing up for the Church.",Catholicism,I am very proud of my priest [Politics Monday],421.0,0.91
CandyDogPrairieDog,0.0,423.0,,Catholicism,"[Free Friday] Jesus Ben Joseph, The Christ (Art by me!)",423.0,0.97
Jnip9090,0.0,418.0,,Catholicism,[FREE FRIDAY] Saint Joseph pray for us,418.0,0.99
KOTC41108,0.0,422.0,,Catholicism,Today I learned that Pope Pius XII was an active conspirator in three plots to remove Hitler from office.,422.0,1.0
Psycho-Radish,0.0,423.0,"That’s why I say it, anyway.",Catholicism,"Admit it: half the time you say ‘catechesis’, it’s because the word sounds cool.",423.0,0.98
augustv123,0.0,419.0,,Catholicism,[Free Friday] Roxann Dawson (B’Elanna Torres on Star Trek Voyager) converted to Catholicism right before she joined the cast of the show,419.0,0.97
ewheck,0.0,418.0,,Catholicism,"Today is the Feast of St. Junipero Serra, a Missionary who Faught for Native Rights Against Conquistadors and for Spanish Citizenship of Natives. He also Taught them New Methods of Agriculture, Cattle Husbandry, and Crafts.",418.0,0.99
[deleted],0.0,417.0,"Hi everyone,

Regrettably I will be deleting my account soon, as a result of ongoing harassment from Reddit users.

I have shared articles and posted my views about the ongoing Cardinal Pell matter in some Australian local subreddits, as well as here, for some time. I expect downvotes and carry-on within the thread, however the extent of harassment and abuse I have received, as well as attempts to doxx me from my Reddit history, is unprecedented, and is impacting my mental wellbeing. I'm not in danger, but no one should have to go through it.

This subreddit, /r/Catholicism, was a great help for me coming back to my faith as a high school student about five years ago, and I'm pleased to see it doing the same work for others every day. This is truly one of the most pleasant places on Reddit, free from obscene jokes and content. All owing to the solid users who commit their participation, and the moderators who actively maintain it. I wanted to thank all of you who treat visitors to this subreddit with charity and earnestness. You are doing more good than you may realise, through a means that gives more opportunities to provide charity and good counsel than can be imagined offline. So I wanted to say thank you and goodbye before I go, and sorry for the instances when I was impatient or short with people (from this account, or from my previous account many years ago). God bless.",Catholicism,Will be deleting my account,417.0,0.96
wat_dafuq,0.0,413.0,,Catholicism,"One of my favorite photos from our wedding this past week. We only had two people in attendance and live streamed our wedding but we couldn't be happier! ""What God has joined together, let no man put asunder"".",413.0,0.99
moachacoffeeguy,0.0,419.0,,Catholicism,This is why street preachers can go to Catholic Churches and blaspheme with no resistance or push back.,419.0,0.97
jellybre,0.0,420.0,"From the Italian word ""quarantina"". May we recognize the presence of God in the desert with us, allow ourselves to sit with hunger and longing for God, for an ever more fruitful Lent united with all the world, to enter even more joyously into the Resurrection.",Catholicism,"The word ""Quarantine"" means ""40 Days""",420.0,0.97
russiabot1776,0.0,416.0,,Catholicism,"Today is the feast of Bl. John Duns Scotus, Doctor Subtilis. Beatified in 1993, Duns Scotus was a Scottish priest, Franciscan, &amp; professor. One of the most important minds of Europe in the Middle Ages, the doctrines he is best known for include the ""univocity of being"" and the idea of haecceity",416.0,0.97
CtxDude,0.0,413.0,"Just completed first reconciliation (RCIA)

Just had to share..recent convert due to the grace of my wife and our Lord, after 20 years of attending church with my family but not being catholic I joined RCIA last year. Unfortunately, due to current world events it threw everything into a mess but Father reached out and said for all of us to attend confession and that this Sunday we’ll be initiated into the church.

Well I just completed my first confession, gotta say for a lifelong Protestant it was a strange and uneasy experience..I prayed hard for grace and peace. Now having done the first one, it was beautiful. I did lose my place halfway through and Father tried to wrap up and I had to tell him I wasn’t done listing my sins (40+ years is a lot)..but it went well and when he absolved me I admit I got a little teary eyed.

Just had to share.",Catholicism,Just completed first reconciliation,413.0,0.98
Jnip9090,0.0,413.0,,Catholicism,Pope invites homeless in Rome to his Mass this Sunday,413.0,0.99
DUDEWAK123,0.0,413.0,"This year we Filipino people are going to celebrate the 500 years of Christianity brought to us by colonizers in 1521, The quote is taken from The gospel of Matthew (10:8) and is the theme for this fine celebration!, the Catholic Church here has decided to choose a church within each diocese for a place for people to gather and take part in this celebration of thanksgiving.  


For anyone wondering what the symbols fully mean here is a link to the Vatican News detailing what each symbol on the design means.  


[https://www.vaticannews.va/en/church/news/2019-09/philipines-church-500-anniversary-celebration-logo.html](https://www.vaticannews.va/en/church/news/2019-09/philipines-church-500-anniversary-celebration-logo.html)

https://preview.redd.it/0x5n5hkqdmd61.png?width=1500&amp;format=png&amp;auto=webp&amp;s=125a33f074bc140c82d47c378a9f33ca4354da74",Catholicism,500 Years of God and Jesus in the Philippines!,413.0,1.0
Ziapolitics,0.0,413.0,,Catholicism,Thirteen nuns from a Michigan convent die from COVID-19 in deadly wave that claimed 12 in just one month and left more than a dozen seriously ill,413.0,0.98
Jezza000,0.0,412.0,,Catholicism,A very relevant picture for free Friday :),412.0,0.93
pretzelking96,0.0,411.0,"I see so many articles concerned with the future of Catholic schools (specifically in the USA) and if they will survive another generation or two. To me this implies that people don't seem to want to send their children there. Is it a coincidence that this is coinciding with the rise of the ""nones"" in society and the faith isn't being passed on?

Unless the Church catechizes the youth effectively, very few are going to grow up and desire to send their children to a school operated by the Church. I don't want to speak for others, but for me as a cradle Catholic personally I feel that I am Catholic in spite of my ""catechesis"" (if you can call it that?) not because of it. Just browse Reddit for \~10 min and you'll quickly see that the Venerable Fulton Sheen was pretty darn accurate when he said:

***There are not one hundred people in the United  States who hate The Catholic Church, but there are millions who hate  what they wrongly perceive the Catholic Church to be.***

So it's no wonder people don't see the value in an education provided by the Church - they don't really even know what the Church is or teaches. If you could go back and quiz a 16 year old me I shudder to think of how I'd answer various basic questions about the faith. Even for kids who go to public school when they do have access to a formal catechism class, there's little substance provided and even less that differentiates Catholicism from any other Christian church. Oh, and less still that offers any compelling reason to stay beyond a few ""feel good"" moments. Catechize more effectively and once those children have their own children, will anybody be surprised by higher enrollments?

I'm interested to hear input from others on this idea! FYI: worded all this a bit provocatively in order to stir some discussion haha. I'm excited for responses!",Catholicism,CMV: Catholic education should focus first on better catechesis,411.0,0.97
Fhlostonparasail,0.0,410.0,"I am sorry if this is against rules; I am just at a loss and trying to be strong for my fiancée firm t the time. We unfortunately didn’t know the gender until after he was stillborn. We had decided between Lucy/Luca depending on girl or boy. We were turned away at 19 weeks from her initial anatomy scan because they said she was too early.  It was only when I was allowed to be with her at a neighboring hospital that we determined the previous hospital “mistranscribed” 1.6 amniotic fluid as 12.6 amniotic fluid. That was last Friday, coincidentally the last day my son had a heartbeat. I am devastated and just wish there were some answers. I’m sorry for rambling I just don’t know what else to do.",Catholicism,Lost our son Luca Nash,410.0,0.99
robbinautumn,0.0,414.0,At least I think it was 14 years... I was so nervous and had everything written out. At the last second I decided to face the priest instead of kneeling behind the screen. I'm not sure what pushed me to but I'm glad I did. There wasn't much time but I wasn't rushed. Now I'm in a state of grace! I'm surprised I finally did it.,Catholicism,Went to confession after 14 years,414.0,0.99
mujwa,0.0,412.0,,Catholicism,Today is the Feast of Our Lady of Mount Carmel.,412.0,0.99
NoTrueScotist,0.0,409.0,,Catholicism,"April 13th is the feast of Saint Airmanagild: Visigothic prince, Viceroy of Baetica, convert from Arianism, King of Hispania and Septimania (in opposition to his Arian father Liubagilds), military commander, and martyr—beheaded on this day in AD 585, after refusing to apostatize.",409.0,0.99
FrMatthewLC,0.0,414.0,,Catholicism,"Canada's new proposed law makes euthanasia free for the disabled but leaves treatments expensive, pushing them towards euthanasia [OC]",414.0,0.98
