author,downs,score,selftext,subreddit,title,ups,upvote_ratio
CumbiaConLaLuna,0.0,574.0,"We've been married a week and while on honeymoon in Mexico she experienced gradually worsening pain and Thursday morning we came back early because of it. I took her to urgent care and we found out she had a 5cm abscess that was infected. We then went to the ER and since then I haven't seen her in person. We talk over the phone but she's so exhausted it doesn't last too long. 

All I want is to be there with her but I can't and I'm so frustrated about it. She's also having a reaction to the medication which is making it hard for her to breathe so the staff is now also dealing with that. I've been trying to distract myself at home by cleaning and organizing but obviously that only goes so far. I just can't believe that the hospital won't even allow spouses to visit, it's almost infuriating. 

Our families are praying for us but if we could have more prayers we'd appreciate it greatly.",Catholicism,My wife has been in the hospital for 2 1/2 days and I haven't been able to see her because of Covid restrictions; just asking for some prayers as honestly it's been difficult to get through,574.0,0.98
Falandorn,0.0,578.0,,Catholicism,"Star of Bethlehem duel-planet occurance visible for first time in 800 years 21st December, once in a lifetime opportunity to see it.",578.0,0.99
Seethi110,0.0,579.0,,Catholicism,I never realized just how strong the phrase “bind and loose” is.,579.0,0.98
Defense-of-Sanity,0.0,581.0,,Catholicism,Does God Exist? Infographic based on Aristotle and Aquinas,581.0,0.98
ZYVX1,0.0,575.0,,Catholicism,"10th of August is the Feast of Saint Laurence (225-258 AD): Roman Deacon, he was Martyred being burned at the stake on this day, victim of Emperor Valerian's persecution of Christians. He's the Third Patron Saint of Rome, after Saint Peter and Saint Paul.",575.0,0.99
AllanTheCowboy,0.0,577.0,"After reading another post, I wanted to share this story.

I made my first confession at 9, my second confession at 10, and my third confession at 34.  Basically I grew up in the 80's and 90's and learned confession wasn't a big deal, and it didn't matter much whether you went.

So I fell into a lot of horrible, horrible sins.  There are some you can read about in my post history.  There are others you cannot.  For about the last 15 years of those 24, on and off I knew I needed to go to Confession; that was what my conscience and my soul needed.  But I was afraid.  I was afraid of what the priest would say and how he would react.  I was afraid of the penance.  I was afraid to say the things out loud.  I was afraid that the Seal wasn't all it was supposed to be.  My only experience had been with face to face confession and I didn't realize screens were still an option.  I was afraid the priest wouldn't absolve me because some of the things I did were just so horrible.

So, a lot of things happened when I was 33-34 and I was finally driven back to the confessional to reconcile myself with God.  It took months to get up the nerve.  I went somewhere other than my parish so I wouldn't be recognized.  I made a list.  It was full of things I did ""countless times"".  Some typical.  Some horrendous.  Some I didn't think of until subsequent Confessions.  So I went in with this list.  I was prepared for judgement, lectures, admonitions, heavy penances, and horrified reactions.  And I knew priests heard everything.  I've got to tell you, I was a great sinner.  I mean GREAT.  Like, great at it.  I was proficient at horrendous sins, and had even felt great accomplishment in how good I was at some of them.  So even though I knew that a priest had heard everything, I still wondered if he would have heard some of mine.

So in I go with my list.  This priest clearly had a playbook for guys like me, looking back.

""Bless me, Father, for I have sinned.  It has been 25 years since my last confession.""  I waited.  I waited for some kind of reaction to how horrible of a Catholic I had been for 25 years.  I got a barely verbal acknowledgement with an ""okay, let's get on with it then"" tone.

He seemed almost impatient as I listed each sin.  He kept giving me an ""mhm"" with this ""okay next sin, hurry it along"" implication.  It felt kind of weird and dismissive at first because part of me wanted to be chastised and berated and condemned.  But he just kept pushing me from one to the next.  This didn't give me time to fall apart or lose my nerve.  In the moment I kind of thought it was ""that sounds like paper... I better push this guy so the other people in line get their turn.""  And maybe there was some of that, but I look back now and I realize he was letting me know ""no problem; we can deal with that.  That one too.  That one too.  That one, too, no problem.  Yep I can absolve that - and I'm going to.  What else?  I can handle whatever you've got there.""  Then when I was done, he was great.  I had started to be worried that it was going to be a quick, ""ok you're absolved, next penitent please.""  But when I finished my list, his main message was ""you came here.  You confessed it.  You aren't here on this day by accident after 25 years.  God brought you here.  God's with you. God will give you the strength.  You keep trying and He will be there.""  And my penance was an Our Father and five Hail Mary's or something along those lines.

That priest gave me exactly what I needed that day.  God sent me to the right priest on the right day for what I needed to be able to come back properly to Him.  None of the things I was afraid of happened.  That confessor made it easy.  The hard part is entering the Confessional, and beginning.

I know how scary it is.  I was terrified.  It took me years to decide to go, and then months after that to actually go.  And that whole time I had nothing to be afraid of.  Nothing at all.  It's the best thing I ever did.

If you're scared, you don't need to be.  If you're ashamed, you don't need to be.  If you're paralyzed, ask Jesus to free you from that paralysis.  You are not beyond redemption.  If I wasn't, believe me that you're not.  You will look back on the day of that confession as the day your life changed forever.  The day your healing began.  The day you started to understand God's love.

And it'll only take about 10 or 15 minutes.  Your whole life can turn around in a quarter of an hour.  You can do this.  God is calling you.  God wants to forgive you.  You just need to go in that little room of healing, and ask him.

You can do this!  Step up.  The Holy Spirit is in you.  Let Him lead.  You can do it!",Catholicism,"For anyone Worried about going to Confession, Here is the Story of my Third Confession, 24 years after my Second",577.0,0.98
SpiceSeagull,0.0,578.0,,Catholicism,This is my necklace of saint james i got for confirmation he’s my patron saint and thought since it’s his feast it was an appropriate time to share,578.0,0.98
Jumpie,0.0,572.0,,Catholicism,[Free Friday] Baby pics,572.0,0.98
catholicchat,0.0,573.0,,Catholicism,College and High School Girls Entering Convent! Prayers Please!!!,573.0,0.99
Defense-of-Sanity,0.0,568.0,,Catholicism,Did Jesus really rise from the dead? A completely scholarly approach!,568.0,0.97
TexanLoneStar,0.0,573.0,,Catholicism,"Today is the Feast of the Prophet Obadiah. In the shortest book of the Old Testament his oracles preach against the Edomites, God's triumph over them, the restoration of Israel, and the Second Coming (Day of the LORD).",573.0,0.99
biggeruppercomer,0.0,572.0,"And it was because of this article below:

**PHILOSOPHERS ON ABORTION AND INFANTICIDE -** ***Frank Bouchier-Haye***

[http://www.minerva.mic.ul.ie//vol2/bh.html](http://www.minerva.mic.ul.ie//vol2/bh.html)

With it, I have several major views on abortion that I am not afraid to share with others when the topic seriously comes up (and it seriously has, myself living in a very liberal city). I want to share a few of the points that come up often, both to hear what others think, but also so we can be legitimate consumers of the truth as political pundits ascend the podiums and spew lie after lie.

**Premise**: It's a woman's body, so it's a woman's choice \[to be pregnant, or not\].

**Answer**: This is a lie. It's not a woman's body, it's the woman's body and the baby's body.

**Premise**: It's okay to abort babies that are not viable outside the womb.

**Answer:** All babies are not viable outside the womb. Or viability is never guaranteed.

**Premise:** Abortions should be permitted for cases of rape and incest

**Answer**: Killing the baby will not undo the crime. It compounds the psychological stress of the act by adding a death to the damage done: the baby is not the rapist. Additionally, children born of rape or incest are not so different from us as we believe, nor do they want to be perceived/perceive themselves as less valuable to our society. One can even go so far to say that there are loving adoptive parents who would happily take such a baby in their home, and give it a future that few could dream of providing their children.

**Premise**: Overpopulation is an environmental issue.

**Answer:** Overpopulation is not an environmental issue, our unsustainable lifestyle is the environmental issue. An American has the same carbon footprint as over 200 people living in rural Africa or India, and these are people who are cooking with charcoal.

**Premise:** Abortions should be permitted if they will spare the mother's life.

**Answer**: There is no agreement among the medical community whether such cases even exist, evidence suggests that there are effective treatments for most situations (treating gestational diabetes and hypertension,up to and including early induction where both the baby and the mother's life can be saved.

**Premise**: Abortions should be permitted if a baby has a life threatening or debilitating/painful condition.

**Answer**: In utero diagnostics can be wrong, very wrong. What if you abort a baby based on a false positive? Supposing the baby were delivered and the condition was found to exist, would it not make sense to foster that child to the best of your ability up to a point of conscientious independent after which they can say whether they wish to live or die, in spite of their disability? For those disabled people, what do you think they largely wish regarding their life?: to live.

**Premise:** Reproductive rights provide economic opportunity to women

**Answer:** in parts:

1. Babies are not exchangeable. The babies that one kills early in one's life are not ""replaced"" when the family chooses to bear (and deliver) children later. 
2. Education and employment opportunities for women are not where they need to be in this country. If for a woman to achieve her best requires that she not have kids, then our society is flawed; we need to support mothers in tangible ways: we need paid parental leave as a federal mandate, we need to provide healthcare for pregnant mothers and early children
3. Low reproductive rate is a looming economic and public health disaster. The solution to this isn't simply telling women to have more babies, but asking what we ought to be doing to support families. ",Catholicism,"Before I became Catholic, my major conversion was becoming pro-life",572.0,0.95
lilbishboi,0.0,569.0,"After almost 2 years of learning, contemplation, and a global pandemic, on June 24th, 2020 I have finally been baptized and confirmed into the Roman Catholic Church. I gotta say, it feels great to be home. May God bless each and every one of you.",Catholicism,It’s been a long time coming,569.0,0.99
TexanLoneStar,0.0,572.0,,Catholicism,Today's the Feast of Pope St. Pius V. An Italian of the Dominican Order he was a proponent of the Counter Reformation against the Protestants and also helped unite Christian monarchs to defend against the Ottomans. Standardized the Liturgy more into what we know today as the Traditional Latin Mass.,572.0,0.98
ZYVX1,0.0,566.0,,Catholicism,"26th of July is the Feast Day of Saint Anne and Saint Joachim, Parents of Our Lady, and Grandparents of Our Lord. Patron Saints of Parents and Grandparents.",566.0,0.98
TanichcaF,0.0,567.0,,Catholicism,"Today is the feast of St. Philip Neri: priest, teacher, mystic, Apostle of Joy, Second Apostle of Rome, and founder of the Oratorians. Also the genuinely most hilarious saint we have. Ora pro minis!",567.0,0.99
mcm9ssi9,0.0,568.0,,Catholicism,"St. JOHANNES BOSCO. Nate in Turin in 1815, ille es le fundator del Congregation Salesian, dedicate al education e attention del juvenes principalmente plus povre, hodie presente in tote le mundo. Ille mori in 1888 e in 1934 es canonisate e nominate ""Patre, Maestro e Amico del juvenes"".",568.0,0.97
Titan9999,0.0,565.0,"... of the cross. Don't shy away from claiming that you are Catholic anymore, if you have been. You know in your heart why you are Catholic. If not... then discover it! The abuse that happened was a sin and a crime that those sinners and criminals will answer for and does not reflect the sincerity and beauty of our Faith. Claim it proudly and celebrate it without doubt nor the taint of the sin of others.",Catholicism,"After the abuse scandal, being a Catholic for many could be awkward, even uncomfortable. I say now that we reclaim what we are all about... the Faith that began when St Peter was commanded by Christ himself to build his church. When you pray before eating lunch in public, make the sign...",565.0,0.97
stroop123,0.0,566.0,"Exactly one month ago this very scared college senior begged you all for prayers for her exam, which ended up being *the* worst experience of her life. I seriously considered voiding the exam and having it unscored, that’s how bad it was. 

Today the scores came out and I am very happy to report that I scored in the 90th percentile! Quite frankly, I was not expecting to get anywhere near this score and genuinely thought I had failed and was having multiple anxiety attacks just thinking about opening the score report today. 

I would sincerely like to thank everyone who offered so much as a Hail Mary for the intentions in the pinned “prayer intentions” post. You have made this student’s day, perhaps even year, in the midst of this otherwise very dark time of isolation and distancing. 

This whole subreddit is in my prayers. I wish I could hug every single one of you (while somehow maintaining social distancing!). 

Thank God. Let us rejoice and be glad!",Catholicism,Dear subreddit..,566.0,0.98
SpiritualApricot7,0.0,563.0,,Catholicism,She is praying and protecting the USA 🇺🇸,563.0,0.94
dom_lorenzo,0.0,561.0,,Catholicism,"[Free Friday] Home altar, praying for all of y'all here!",561.0,0.99
[deleted],0.0,566.0,"Last Sunday I, along with the other 3 people in my RCIA class, were finally made Catholic and took our first communion. It was a long, strange journey and I'm so happy to start on the next phase of the path. (tl;dr - atheist for first 30 years of life, had some weird experiences, and here I am after 35 years.)

Unfortunately, due to COVID-19 the church has to limit attendance (and rightly so), but I managed to get a seat at the daily mass tomorrow. I plan on going to confession before the mass. This will be my first confession and reception of the Eucharist that isn't part of a ritual or ceremony. It's all very exciting.

I don't know anyone who really cares about stuff like this, so I am sharing it with a bunch of strangers on the internet.

Bonus: bad photo of me going to receive my first communion. I nearly collapsed afterward. (Not because of the heat, but it was also hot.)

&amp;#x200B;

https://preview.redd.it/8e1zx8nwv5f51.jpg?width=540&amp;format=pjpg&amp;auto=webp&amp;s=940cd495f575b8ac4368e728591d87b344e01436",Catholicism,"New Catholic, Who Dis?",566.0,0.98
Master-Thief,0.0,562.0,,Catholicism,"Cardinal Pell, on spending 13 months in prison for a crime he did not commit: ""For many years, I had told the suffering and disturbed that the Son of God, too, had trials on this earth, and now I myself was consoled by this fact.""",562.0,0.97
modernwhale465,0.0,559.0,"So first just a little bit of background, I’m an enrolled citizen of a federally recognized tribe, while many people claim to have Native American ancestry they have no connection to the Native American community, their ancestry, culture, or language. So before somebody claims I’m just some white person whose grandma claimed had some distant relative who was maybe full-blood Cherokee, I can assure you this is not the case. I moved back to my tribal land to serve my community and engage my tribe consistently. I study my people’s language ᏣᎳY and want my children to speak it as well. 

Now that it’s out of the way let me just say that first and foremost I am Catholic, and being Native and Catholic are not mutually exclusive. Many people like BLM and other groups are calling out for the injustice done to Native Americans by early Catholics and it makes my blood boil. They care so much about tearing down statues of St. Louis and other saints for no other reason than blind rage, and I see some Catholics act passively as if it doesn’t matter. Everyone who wants to tear down a statue of a Saint is undoubtably wrong and misguided. I know I’m preaching to the choir but I think the point I want to make is that they do not actually care about Native Americans at all. NA’s have the highest teen pregnancy rate among American ethnic groups, poverty and alcoholism are rampant on reservations, and not to mention the countless missing and murdered indigenous women right here in America. If they actually cared why aren’t they helping with any of those issues that actually effect the lives of Native Americans? Why not help the Covid epidemic on the Navajo Reservation? 

The question may come up about all the historical trauma that NA’s went through by Roman Catholic clergy and missionaries and I agree it was evil but that does not negate that massive NA population within the Catholic Church here in America. Here are some facts for those who want numbers: 


http://www.usccb.org/issues-and-action/cultural-diversity/upload/Two-Rivers-On-Catholic-Native-American-Culture-and-Diversity.pdf

There are many devout Roman Catholics within the Native community, we even have Saint Tekekwitha! I wish the Bishops here in America would turn their eyes to suffering of indigenous brothers and sisters who so desperately need it. I wish Bishop Barron had said “we will help the people Pine Ridge SD” instead of “not my problem”. So many people now think Native Americans only existed between Columbus to cowboys, not realizing the Canadian government was abducting First Nation children and trying to civilize them up until 1997! So for anyone who defends these protestors thinking they are helping Natives, you are not, in fact you are hurting 20% of NA’s by attacking their faith. 

I don’t speak for all natives and I’m sure there are many who would disagree with me, but as a NA Catholic I cannot let these people speak for me. BLM is protesting for civil rights, the indigenous people of this country want political rights, our treaties to be recognized, and our people to be given to them what they deserve, so you yelling at a faithful Catholic priest for defending a statue of St. Louis isn’t helping, it’s reducing NA problems down to a civil level which it isn’t. 

For my Catholics I just want to say there is no reason to apologize or white wash history, obviously recognize the historical trauma sure but don’t feel bad for the sins of others. 

I’ll wrap up with an interesting fact, Father John Shoenmakers, a Jesuit priest brought Catholicism to the Osage People and impacted them so much that the Osage word for priest is “Sho-Mink-Ah” and they still have a thriving RC church on the Osage Reservation today! 

http://kathleenmaca.com/index.php/2018/05/02/church-of-the-osage/


https://www.tulsaworld.com/lifestyles/pawhuska-church-builds-shrine-to-first-american-indian-saint/article_565a8a36-ba6e-5d8a-9b93-6a19f96e1386.html


St. Tekekwitha pray for us. 
ᏩV",Catholicism,My perspective as both Catholic and Native American,559.0,0.98
skysudds,0.0,559.0,"So, first off often I post in r/Christianity, but in coming back to Catholicism I've started posting and reading in this subreddit as well.  Anyway, my posts often get downvoted in that other subbreddit and my comment karma has been decimated.  LOL literally decimated at -100 now.  This isn't so much a ""hurt my feelngs"" thing as it means I can't comment on other peoples posts on reddit more than once every 5 minutes it seems.  

I've yet to have a single posts downvoted here and I was asking some pretty tough questions when coming back to the Church.  Got a +19 vote on a simple comment on here yesterday which will hopefully soon take me out of the -100 5 minute wait territiory.  

It's not only the upvoting here, but the attitudes and comments follow along with the positivity way more than what I'm used to.  I wanted to say that in coming back to Catholicism you guys on here have made me feel really encouraged about that choice by your positivity.  It's proof to me that there is an underlying unity in the Church that is missing in Protestantism.  I've missed that dreadfully in my separation and it's good to have it back... don't really know what you are missing till its gone sometimes ;).",Catholicism,Something I've noticed that is very positive about r/Catholicism...,559.0,0.96
SurfingPaisan,0.0,559.0,,Catholicism,Inside Rheinau Switzerland Catholic Monastery,559.0,0.99
PM_ME_AWESOME_SONGS,0.0,560.0,,Catholicism,"""Catholics for choice"" can't use ""Catholics"" in its name anymore in Brazil, rules court",560.0,0.97
Gersh0m,0.0,557.0,I saw [this](https://www.theamericanconservative.com/dreher/melanie-diodati-truth-to-villanova-power/) on Rod Dreher's blog.  This lady has guts and has paid for this by having to leave Villanova.  We really need some kind of network of mutual support that makes stands like this easier to make.,Catholicism,Catholic Student Calls out Villanova for Support of LGBT in Violation of Church Teaching,557.0,0.89
lilbishboi,0.0,557.0,,Catholicism,I’d do anything to have a father like St. Joseph in my life.,557.0,0.99
xenoman101,0.0,551.0,,Catholicism,Mary knew...,551.0,0.98
[deleted],0.0,555.0,,Catholicism,[Free Friday] Catholic Flag of Quebec with the Sacred Heart and Fleur de Lis.,555.0,0.99
frigoffdrunkjimlahey,0.0,545.0,,Catholicism,Amen and Awomen???,545.0,0.96
IrishAmerican4,0.0,551.0,,Catholicism,Bishop Edward C. Malesic will become the 12th Bishop of Cleveland later today!,551.0,0.98
[deleted],0.0,551.0,,Catholicism,First Catholic Russian Bishop Since the Fall of Communism,551.0,0.99
ElKonig,0.0,548.0,,Catholicism,[ Free Friday ],548.0,1.0
CatholicMemer,0.0,548.0,,Catholicism,Thought some of you may find this useful.,548.0,0.96
pheonixfeather_,0.0,546.0,,Catholicism,[FREE FRIDAY] Happy four week anniversary to my husband on loan from Mary. It was a struggle to get married in the Catholic Church during Covid-19 shut downs (our local parish is still closed) but we were able to have a small 10 person ceremony. This is my favorite picture of the day.,546.0,0.98
occasionalpragmatism,0.0,544.0,"I just had my first confession in 14 years. If you haven’t been in a while, you should go. It’s such a powerful experience, and I feel so light it’s incredible. I always thought people were exaggerating, but it’s true.",Catholicism,Confession,544.0,0.98
digifork,0.0,592.0,"This is a follow-up to our [original post](https://www.reddit.com/r/Catholicism/comments/lsxh4k/important_annoucement) concerning comment removals by the Anti-Evil Operations team.

Our discussions with one of the Reddit admins have stalled. We have recontacted the Reddit admin staff to see if we can speak to someone who is willing to discuss the matter. In the meantime, still know that if you wish to promote Church teaching on LGBT issues in this subreddit, it is at your own risk as the mods of this sub have no say in what AEO removes or which users they suspend.

For full transparency, we are posting [this snapshot](https://i.imgur.com/zpKF6Op.png) of the conversation thread with the username of the admin redacted for privacy.

We still ask that our subscribers not talk about this situation until our discussions with the admins have run their course. We would also like to add that we are not trying to rebel against Reddit in any way. We would just like clarity as to whether religious speech will be tolerated on their platform.

We will continue to keep the community updated on the ongoing discussions with the admin team over AEO's actions and we ask that you pray for this community so that we may be able to continue discussing our faith on Reddit.

*Ad Jesum Per Mariam*

\- Mods of /r/Catholicism",Catholicism,Important Announcement (Update 1),592.0,0.98
zaserman,0.0,551.0,"This is a shitpost but I’m still gonna make it. So many sports legends are Catholics.

Kobe Bryant - Catholic

Tom Brady - Catholic

Arnold Schwarzenegger - Catholic 

Lionel Messi - Catholic 

Lebron James - Catholic

Micheal Phelps - Catholic 
 
I could go on

Edit:

Usain Bolt - Catholic 

Simone Biles - Catholic 

Babe Ruth - Catholic 

Mathew Hayden - Catholic 

Joe DiMaggio - Catholic

Nick Saban - Catholic

Vince Lombardi - Catholic 

Cristiano Ronaldo - Catholic 

Edson Arantes do Nascimento (Pelé) - Catholic

Katie Ledecky - Catholic

Roger Federer - Catholic

Justin Tucker (GOAT NFL kicker) - Catholic

Brett Favre - Catholic

Stipe Miočić (UFC Heavyweight Champion) - Catholic

Eliud Kipchoge(world record marathon) - Catholic.",Catholicism,All GOATs are Catholic,551.0,0.95
