author,downs,score,selftext,subreddit,title,ups,upvote_ratio
nonoesca,0.0,3959.0,,Catholicism,I finally made a mask I'm proud of!,3959.0,0.93
saderead,0.0,2329.0,,Catholicism,Our brothers in Mozambique with the Blessed Virgin Mary. Please take some time to pray for them as the suffer increasingly violent persecution.,2329.0,0.97
justoutofwaldorfs,0.0,2288.0,,Catholicism,Pope Francis preparing to pray in an empty St Peter’s Square,2288.0,0.98
ThomasDowd_ca,0.0,2205.0,,Catholicism,Today is my 9th anniversary of ordination as a bishop.,2205.0,0.9
Lego349,0.0,2180.0,,Catholicism,Happy International Women’s Day!,2180.0,0.92
Sceilg,0.0,2120.0,,Catholicism,An Irish Catholic family outside their home in 1932,2120.0,0.99
balrogath,0.0,2086.0,,Catholicism,Ordination yesterday. First Mass today.,2086.0,0.93
cjcstudies,0.0,2084.0,,Catholicism,"Confirmed last Sunday :) I was wiccan and atheist before (and was baptized protestant). Just posting to say not to give up on your friends and family who are non believers. Also, social media evangelization works. That's the means by which I found the Catholic Church. Glad to be home with y'all!",2084.0,0.83
nickmcapone,0.0,1991.0,,Catholicism,"Today I proposed to my girlfriend, who I’ve known since our First Communion. Best part was Our Lord being present within the BS. I want to witness to any men preparing to do the same to trust in Christ &amp; His Mother to procure a beautiful engagement &amp; they won’t fail!",1991.0,0.94
theriderofrohan7,0.0,1900.0,,Catholicism,Happy 100th birthday to pope John Paul II,1900.0,0.96
ImperialUnionist,0.0,1895.0,,Catholicism,[FREE FRIDAY] Japanese Mother Mary,1895.0,0.98
balrogath,0.0,1868.0,,Catholicism,A photo of the vestment I'll wear at my first Mass in 30 days! A gift from my parents.,1868.0,0.96
daworldismyclassroom,0.0,1844.0,,Catholicism,Alleluia Alleluia Alleluia! Christ has risen! He has risen indeed! Happy Easter to you and your family!,1844.0,0.95
ValeMatt,0.0,1827.0,,Catholicism,"Look at that beautiful photo - Christ, the Moon and the Church",1827.0,0.98
Pale-Cold-Quivering,0.0,1802.0,,Catholicism,"Today is the feast day of Pope St John Paul II. Pope John Paul II, pray for us.",1802.0,0.96
quis-contra-nos,0.0,1780.0,,Catholicism,"Yesterday, a Catholic bishop was enthroned at Nidaros Cathedral in Trondheim, Norway, for the first time since the Reformation",1780.0,0.96
Ethanthepirate,0.0,1762.0,,Catholicism,This moment will define Pope Francis’ Papacy in history,1762.0,0.97
nexview_io,0.0,1753.0,,Catholicism,"Lord, hear our prayer.",1753.0,0.97
Falandorn,0.0,1690.0,,Catholicism,An oil painting I just finished for the local Carmelite monastery in Birkenhead,1690.0,0.99
[deleted],0.0,1676.0,,Catholicism,Football ultras defending their churches against left-wing demonstrations in Poland,1676.0,0.88
HmmYesThatsGreat,0.0,1669.0,,Catholicism,Stolen from /r/coolguides,1669.0,0.98
Theoson,0.0,1649.0,,Catholicism,"My latest painting: ""Salvator""",1649.0,0.97
not_prepared,0.0,1637.0,,Catholicism,Fireman praying to our Lady in Zagreb after helping earthquake victims that happened 22.03.2020. Pray for us in Croatia!,1637.0,0.98
Lego349,0.0,1635.0,,Catholicism,"Today is the 4th Anniversary of the martyrdom of Fr. Jacques Hamel, Servant of God, who had his throat cut in front of his congregation by two Muslim men swearing allegiance to ISIS. His final words as he resisted his murderers were “Go away, Satan!”",1635.0,0.98
Jnip9090,0.0,1641.0,,Catholicism,One of the most powerful video I saw in a while,1641.0,0.97
xenoman101,0.0,1599.0,,Catholicism,Mary comforts Eve,1599.0,0.98
ChanceOld669,0.0,1605.0,I have an unplanned pregnancy. I was afraid of getting caught by my parents because I'm only 17 and I was raised Catholic. I live in Texas where I wanted to use Jane's due process to get a judicial bypass to have the abortion so my parents wouldn't find out. I was dm by a woman on the abortion subreddit. She reminded me about the moral law.  I'm not having the abortion. I was afraid my mom and dad would completelt freak out but I was wrong . God wanted me to keep my baby 🙌,Catholicism,I'm keeping my baby 🙌,1605.0,0.93
boredomtheorytherapy,0.0,1581.0,,Catholicism,"Hi everyone! My daughter was baptized, confirmed, and received her first communion last night! Please welcome this little saint to the Church.",1581.0,0.91
NordyNed,0.0,1558.0,,Catholicism,100 Years Ago Today [15 May 1920]: Joan of Arc is canonized as a saint in the Catholic Church,1558.0,0.99
MDK___,0.0,1546.0,,Catholicism,"Even though we are Roman Catholic, we should all pay our respects to the Patriarch of Serbia and the Coastal Lands, Irenaeus, who died today. (1930-2020)",1546.0,0.97
[deleted],0.0,1516.0,,Catholicism,Happy birthday Pope Francis!,1516.0,0.95
[deleted],0.0,1515.0,"I'll join a carmelite convent in a week, so  slowly but sure it's time to say goodbye also to reddit. 
Thank you so much!! Without you, the people of this subreddit, my faith wouldn't be what it is today - all the things I learned here and all the good advice, it was incredible. :-) 
See you!",Catholicism,Good bye :-) going to the convent!,1515.0,0.95
Ladymeemo,0.0,1506.0,,Catholicism,Mother Mary ❤,1506.0,0.92
arturowise,0.0,1507.0,,Catholicism,Hundreds of Catholics in France praying the rosary for the restitution of Holy Mass in the country,1507.0,0.95
caballitodetequila,0.0,1487.0,,Catholicism,"**October 15th is the feast of Saint Magdalene of Nagasaki, Virgin: 23-year-old Kirishitan noblewoman, lay Augustinian, catechist, interpreter, and martyr of the Tokugawa persecution—killed by tsurushi on this day in 1634, after refusing to apostatize throughout 13 days of torture.**",1487.0,0.98
vitc703,0.0,1483.0,,Catholicism,Fr. Ragheed Ganni— martyred by ISIS,1483.0,0.97
scottsmith81,0.0,1469.0,,Catholicism,"Bishop Strickland carrying Jesus to the world! This is how they're keeping the light on during the pandemic in the Diocese of Tyler, Texas.",1469.0,0.95
NoTrueScotist,0.0,1470.0,,Catholicism,"May 30th is the feast of Saint Joan of Arc, “the Maid of Orléans”: French peasant girl, Catholic mystic, and Virgin-Martyr, falsely convicted of heresy and burned at the stake on this day in 1431.",1470.0,0.99
Cat__Art,0.0,1465.0,,Catholicism,Almost finished my first painting of the Sacred Heart!,1465.0,0.99
Summerfieldsforever,0.0,1465.0,,Catholicism,"[Free Friday] Lamb of God with St. Joseph, anime style. By Apapico",1465.0,0.96
Lego349,0.0,1441.0,,Catholicism,Reminder: to wish death upon any person or group out of anger is considered a mortal sin according to the Catechism of the Catholic Church.,1441.0,0.97
Skullbone211,0.0,1448.0,,Catholicism,Yesterday I was installed as a Lector! This is my second big step on the way to priesthood,1448.0,0.92
Iam1-94,0.0,1437.0,,Catholicism,Christmas Eve mass at my church. Love from Vietnam. 🇻🇳,1437.0,0.94
Jnip9090,0.0,1429.0,,Catholicism,[FREE FRIDAY] Beautiful picture of our Saviour and our Mother,1429.0,0.97
EnModestoSeLaPasa,0.0,1423.0,,Catholicism,33 men were ordained into the priesthood today in the archdiocese of Guadalajara,1423.0,0.93
violette7marie,0.0,1417.0,,Catholicism,My husband and I have been married for 16 years but we finally had our marriage convalidated this past Friday. God Bless this community.,1417.0,0.94
Defense-of-Sanity,0.0,1414.0,,Catholicism,What did the FIRST Christians believe? A brief look!,1414.0,0.96
Jnip9090,0.0,1414.0,,Catholicism,[FREE FRIDAY] Beautiful art of Jesus,1414.0,0.97
balrogath,0.0,1412.0,,Catholicism,"I've been ordained for a few months, but today was when I was able to pick up the trophy for my most prominent achievement.",1412.0,0.96
saltarinreboton,0.0,1409.0,,Catholicism,Argentina's pro-life march,1409.0,0.87
SouthernDesire,0.0,1397.0,"I was baptized today in a private, modified ceremony and will be receiving the other two Sacraments on Pentecost Sunday. It feels incredible to be able to now call myself Catholic. After two years of being a catechumen, I’m finally home ❤️",Catholicism,I’m officially a Roman Catholic!!!,1397.0,0.96
jmbfhu92,0.0,1397.0,,Catholicism,"My wife (raised Catholic) and I (just finished RCIA) got married two years ago, but today we finally were able to really get married in the church! Tomorrow I will be confirmed after having to wait for 2 1/2 months due to coronavirus. God is good!",1397.0,0.94
Rytho,0.0,1400.0,,Catholicism,The New York Times doesn't know what a Rosary is,1400.0,0.94
Jnip9090,0.0,1397.0,,Catholicism,[FREE FRIDAY] This picture was removed other day. Hope it's stays on friday. It's gorgeous and i want to share it :),1397.0,0.93
wolfgangp,0.0,1388.0,,Catholicism,[Free Friday] We married after being away from the Church for most of our adult life,1388.0,0.97
faustus_primo,0.0,1345.0,,Catholicism,"I was received into the church yesterday! After seven months of delays, my joy is immense. Glory be to God!",1345.0,0.93
ZYVX1,0.0,1339.0,,Catholicism,"Fr. George Lemaître explaining his new ""Big Bang"" Theory to Venerable Pope Pius XII:",1339.0,0.99
shaunmcafee,0.0,1330.0,,Catholicism,(free Friday) Religious order vestments I made Animal Crossing! Details in comments :),1330.0,0.98
Halo_Dood,0.0,1328.0,,Catholicism,"{Free Friday} Us Catholics should maybe reconsider our support of Disney because if you haven't realized it yet, Disney isn't what it once was. ""If a righteous man turns from his righteousness and commits iniquity, he will die for it.""",1328.0,0.96
bigrigging,0.0,1330.0,,Catholicism,For those who are still learning how to pray the Rosary properly,1330.0,0.95
HeartCaveHermit,0.0,1327.0,,Catholicism,[Free Friday] I used to draw pornography. Now I put my skill to better use and make reparations for my sins at the same time👍. I'm hoping to get into iconography in the next few months!,1327.0,0.98
JOyo246,0.0,1319.0,,Catholicism,Proposed two weeks ago! Right after finishing our consecration to Jesus through St. Joseph,1319.0,0.95
TexanLoneStar,0.0,1315.0,,Catholicism,Today is the feast of St. Charles Lwanga and his 21 companions. Martyred between 1885 and 1887 by the King Mwanga of Uganda for being Christian and rebuking the actions of the King. Most of them being burnt alive alive being tortured.,1315.0,0.98
Jumpie,0.0,1313.0,,Catholicism,[Free Friday] Catholic social distancing distance,1313.0,0.98
smashpass83,0.0,1312.0,,Catholicism,"CNA: Pope Francis calls for civil union law for same-sex couples, in shift from Vatican stance",1312.0,0.9
philliplennon,0.0,1299.0,,Catholicism,[Free Friday] Tolkien vs Lewis on allegories comic.,1299.0,0.99
Middleearthgirl,0.0,1298.0,,Catholicism,Sticker I drew to illustrate this beautiful faith. Proud to be a convert. 🤍,1298.0,0.95
ElKonig,0.0,1303.0,,Catholicism,"Pope Benedict's brother dies today, at the age of 96. They've become priests together",1303.0,0.99
sangbum60090,0.0,1297.0,,Catholicism,"Remember this priest from Titanic? He was a real person named Fr. Thomas Byles who stayed on the ship to help passengers escape and gave absolution and prayed with more than a hundred people. Pope Pius X later described him as a ""martyr for the Church"".",1297.0,0.99
TexanLoneStar,0.0,1292.0,,Catholicism,"The Catholic origins of saying ""God bless you"" after someone sneezes.",1292.0,0.99
caballitodetequila,0.0,1283.0,,Catholicism,14 innocent spanish nuns. Martyrs of the red terror. Tortured and killed for their faith. They are now Blessed nuns. Viva Cristo Rey!,1283.0,0.96
TexanLoneStar,0.0,1284.0,,Catholicism,"Today is All Souls Day, the final day of Hallowtide it is a commemoration of all the faithfully departed and is the only day of the year during which all liturgies must be Requiem Masses and Offices for the Dead.",1284.0,0.98
-The_Weeb_Lord-,0.0,1280.0,"So I'm 16. A year ago in August I was diagnosed with stage 4 brain cancer. After some research I learned that only 5% of patients survive more than a year. I really don't want to die, so please pray for me",Catholicism,Pray for me,1280.0,0.98
dogwood888,0.0,1270.0,,Catholicism,"[Free Friday] Merry Christmas, rejoice in Jesus!",1270.0,0.94
britneyspearmintgum,0.0,1271.0,,Catholicism,[Free Friday] My Grandma’s 1960 Communion Pic!,1271.0,0.99
GodsABullet,0.0,1263.0,,Catholicism,"Baptised, confirmed and first communion-ed. It's been decades in the making. Finally I am home.",1263.0,0.95
ThePenguins2020,0.0,1262.0,,Catholicism,We did it the right way and it was worth it 🇻🇦,1262.0,0.89
Middleearthgirl,0.0,1253.0,,Catholicism,"When I was 6 I struggled with insomnia. One night while praying that I could fall asleep, I opened my eyes and saw Jesus standing in front of my bedroom wall. I've never forgotten that vision.",1253.0,0.94
NomadCRAYOLA,0.0,1253.0,,Catholicism,Remember to give thanks to our savior today. Remember he loves each and every one of you and wants the best from you.,1253.0,0.97
jerodious94,0.0,1260.0,"So for a long time (probably about ten years) I’ve struggled with a porn addiction. It only got worse over the last year or two where I’ve been mostly away from the church. It got to the point where I was actually paying to see women sexualize themselves on OnlyFans, ironic considering how I also spent that time speaking on the negative effects of websites like OnlyFans.

Well this past week I went to mass and confession after about a year away from the church, and suddenly, all that passion and excitement for my relationship with Christ that I felt when I was confirmed came back to me.

Last night, I was reading a few chapters of Luke before doing my penance, and I paused for a moment, pulled out my phone and deleted my OnlyFans account. It took a lot to do, and I felt overwhelming temptation to not do so, but the wave of relief that flooded me when I hit that delete button was unlike anything I have experienced.

I just moved to where I’m living right now so I haven’t really met anyone yet to share my joy with, so I’m sharing it on here.",Catholicism,Last night I deleted my OnlyFans account,1260.0,0.9
domo195,0.0,1246.0,,Catholicism,"Pro life procession with sing rosary in Zagreb, Croatia",1246.0,0.87
Jose_Roblesss,0.0,1232.0,,Catholicism,St. José Maria Robles my great uncle. He died for his faith during the cristero war in Mexico.,1232.0,0.99
Ayenotes,0.0,1210.0,,Catholicism,Number of women becoming nuns hits 25-year high,1210.0,0.98
Im_A_Potato521,0.0,1207.0,,Catholicism,"Today is the feast day of St. Francis of Assisi, patron saint of animals and the environment, pray for us!",1207.0,0.98
Skullbone211,0.0,1198.0,,Catholicism,"[Free Friday] As a seminarian, this is one of my favorite paintings. Reminds me of what a priest is called to do, no matter where or when",1198.0,0.98
awnpugin,0.0,1201.0,,Catholicism,"et ça c'est le thé, soeurs!",1201.0,0.97
pastaoftheplague,0.0,1200.0,,Catholicism,"Left the faith in high school, making my way back and just bought my first rosary ☺️",1200.0,0.96
colleendoodles,0.0,1191.0,,Catholicism,[FREE FRIDAY] “Lord of the Unborn”,1191.0,0.93
Gerrigen,0.0,1183.0,"Yes, we detest and abhor child abuse as much as you do.

We fully support the many reforms of the last 20 or so years to eradicate the systemic issues that allowed for these events to be covered up all those years ago.

We are grateful to see these skeletons unearthed for a variety of reasons, but mostly so we can pray for the victims and, yes, their evil tormentors. 

But, this is in no way viewed as an indictment on the Faith itself. As Catholics we know the Church is made up of people and people can span the vast array of dispositions from evil to righteous. 

We don’t have our ecclesial members on some divine pedestal, nor do we believe they are any less likely to do horrible things than you or I.

We believe the Holy Spirit preserves the teachings of the Church. Which is what we hold to even more strongly in times such as these.",Catholicism,As people doubtless come to our sub today for perhaps the first time.,1183.0,0.96
JosephusTurchimanus,0.0,1184.0,,Catholicism,"The Apostolic Vicar of Istanbul, Bishop Ruben Tierrablanca Gonzalez, has just passed away. Please pray for his soul 🙏🏻",1184.0,0.97
moachacoffeeguy,0.0,1185.0,,Catholicism,[Free Friday] Our Lady of Africa,1185.0,0.98
TanichcaF,0.0,1181.0,,Catholicism,"Pope Francis just declared this liturgical year to be the year of St. Joseph! Terror of demons and patron of the Church, pray for us!",1181.0,0.99
2Fritz2,0.0,1180.0,,Catholicism,Merry Christmas Everyone!,1180.0,0.99
TanichcaF,0.0,1175.0,,Catholicism,My older brother is a leatherworker. He hand-made and hand-carved this exquisite leather backpack for a client! [Free Friday],1175.0,0.99
Jnip9090,0.0,1181.0,,Catholicism,[FREE FRIDAY] Our only King Jesus,1181.0,0.95
USDA_CertifiedLean,0.0,1171.0,,Catholicism,"Priest shot at Orthodox church in Lyon, France. Please pray for our Orthodox brothers and sisters as well as for the people of France. Lord have mercy.",1171.0,0.98
Defense-of-Sanity,0.0,1172.0,,Catholicism,Purgatory Infographic! Let me know what you think!,1172.0,0.95
Theoson,0.0,1166.0,,Catholicism,"My latest painting: ""Gethsemane""",1166.0,1.0
deusvult1143,0.0,1158.0,,Catholicism,"Statue of Padre António Vieira was also vandalized. 17th century Portuguese priest and missionary who fought for the well being of slaves and for the liberties of the indigenous peoples. Also known for being a writer and philosopher, he is known for the Sermon of St. Anthony to the Fishes.",1158.0,0.99
wolly123,0.0,1160.0,,Catholicism,"Pope says autistic kids are beautiful, unique flowers to God",1160.0,0.96
ericarmusik,0.0,1153.0,,Catholicism,"[Free Friday] My painting of the Temptation of Christ, oil on birch, 48 x 60” 2020",1153.0,0.99
manwithfacts,0.0,1157.0,,Catholicism,It has been 1 year since the Notre Dame Cathedral fire. Remember it like it was yesterday!,1157.0,0.98
JourneymanGM,0.0,1157.0,,Catholicism,404 Prayer to St. Anthony,1157.0,0.98
87broseidon,0.0,1148.0,,Catholicism,Kept forgetting to post this on Free Friday. My daughter right before she got baptized in March!,1148.0,0.96
hbsatw,0.0,1141.0,"I got baptized today and received my first Holy Communion.

Hope all of us grow in our faith with the help of His grace!",Catholicism,I’m a Catholic,1141.0,0.97
mattyO4,0.0,1134.0,,Catholicism,My oldest daughter received Jesus today! She is over the moon.,1134.0,0.84
caballitodetequila,0.0,1136.0,,Catholicism,"*September 20th is the feast of the Korean Martyrs, commemorating some of the approximately 10,000 missionaries and indigenous Catholics executed by the Joseon dynasty between 1791 and 1888.*🇻🇦",1136.0,0.98
Joe_Potter,0.0,1138.0,,Catholicism,"Martyrs of the Christian Faith! 5 years ago like now 16 people in total (among them 4 nuns of the Missionaries of Charity, founded by Saint #MotherTeresa of Calcutta) were killed in terrorist attack in Aden, #Yemen",1138.0,0.97
Nobre_Patriota,0.0,1129.0,,Catholicism,"[Free Friday] Inside look of the Basilica of Our Lady of the Rosary - Caieiras, São Paulo, Brazil.",1129.0,0.99
theundercoverpapist,0.0,1127.0,,Catholicism,"My daughter, Beatrice, received her First Communion last weekend...",1127.0,0.95
CaptainSkull2030,0.0,1124.0,,Catholicism,'Christ in the Wilderness' by Ivan Kramskoi (nice image for Lenten contemplative prayer),1124.0,0.98
Jnip9090,0.0,1120.0,,Catholicism,February 16th is the Feast day of the Holy face of Jesus,1120.0,0.98
CoastalCall,0.0,1108.0,,Catholicism,"Franciscan Sisters of Christian Charity at Holy Family Convent Manitowoc WI, sew non-clinical use Face-masks for employees at St. Paul Elder Services and Holy Family Convent.",1108.0,0.99
maruso,0.0,1107.0,"We've been together for 8 years (since we were 18). I couldn't imagine a better partner.

Only an hour to go! 

Please pray for us!

Edit: it's almost 7:30pm and some guests decided to come over and spend some time with us. Considering coronavirus and all (low infection rate state &lt;1%) this all feels really nice. I appreciate all the well wishes here! My family wasn't present because they are very toxic to me and feeling the love here is so lovely. Thank you so much!",Catholicism,I'm getting married today!,1107.0,0.97
[deleted],0.0,1106.0,,Catholicism,I'm an Ex jehovah's witness finally and I finally bought my first rosary,1106.0,0.99
guanaco55,0.0,1108.0,,Catholicism,"'The Bible in a Year' Is the Most Popular Podcast in the U.S. -- The Scripture-study podcast produced by the Catholic group 'Ascension Presents' sits atop Apple’s charts ahead of major news shows, a hopeful sign in the darkness.",1108.0,0.96
Jnip9090,0.0,1112.0,,Catholicism,[FREE FRIDAY] Really nice and simple explanation why we pray to Mary and Saints,1112.0,0.98
ironicsadboy,0.0,1102.0,,Catholicism,"[Free Friday] Today pope emeritus Benedict XVI becomes the longest-living Pontiff ever. At 93 years, four months and 19 days, he surpasses Pope Leo XIII from today.",1102.0,0.98
NoTrueScotist,0.0,1098.0,,Catholicism,"July 6th is the feast of Saint Maria Goretti, Virgin: 11-year-old Italian peasant girl, pious Catholic, and martyr of chastity—stabbed to death in 1902, for refusing to submit to rape.",1098.0,0.99
Middleearthgirl,0.0,1096.0,,Catholicism,I chose Joan of Arc as my confirmation saint when I got confirmed this year. Drew this sticker for my laptop as tribute 🙏🔥,1096.0,0.98
Bichvar,0.0,1100.0,,Catholicism,I was searching my attic the other day and I found this crucifix my late father made.,1100.0,0.99
ZYVX1,0.0,1095.0,,Catholicism,"Jérôme Lejeune, french doctor who discovered the cause for Down Syndrome, and a strong pro-life activist who fought against the new eugenic abortion policies of the french state, has just been declared a Venerable today by Pope Francis:",1095.0,0.98
[deleted],0.0,1098.0,,Catholicism,"I have been wanting to take my camera to Adoration, here is my first shot!",1098.0,0.98
Jnip9090,0.0,1087.0,,Catholicism,[FREE FRIDAY] Pope John Paul II pray for us,1087.0,0.96
miserereremeideus,0.0,1086.0,"Nothing feels more ""punk"" than coming out as Catholic in my part of the world (urban Canada). Really, what could be more seen as aggressively ""regressive"" by your average boomer or ""cool kid"" than that? Sure, one could be forgiven were he drawn to, say, Eastern Orthodoxy, what with the cool beards and the mesmerizing chants (don't get me wrong, I love the Eastern tradition), but Catholicism... ugh, right?

My father thinks I've gone crazy (""I believe in science!"" Me too, dad, me too: gratia non tollit naturam, sed perficit). My wife is positively angry that I could, in her words, let myself be brainwashed. And her eyes gleam with such scorn and naked hate when she talks about prayer, the Rosary or the Saints, that sometimes I really do wonder if there might be something else, more sinister at play (perish the thought!)... 

(Yet all this makes me want to love them more and pray even more earnestly for them. Meditating on the Sorrowful Mysteries is especially fruitful (pun intended) for me.)

To think that I thought I had a secret weapon.

Not to convert them. But at least to make them pause.

And entertain the idea, maybe. That this is not ""brainwashing"".

After all, I am an educated guy, an intellectual bulimic with a Master's degree in Classics, or rather your average insufferable know-it-all history buff and languages nerd, a voracious reader of Old Boring Books (tm), AND a former militant atheist to boot. My conversion should at least bring them to stop and think that there may be something to my madness. Right? I mean right?  After all, did I not convert via philosophy? Did I not desperately fight with all my pride against that conversion? Does this not register?

Turns out that no. It does not.

Christ made me see my pride and vanity, but I was not ready to see what others really thought about me. My opinion holds no sway after all. All glory to you, Lord! Have mercy upon me!

But what about the company I was now keeping, the countless thinkers, writers, artists and mystics that enriched our great tradition, do they not forbid one to  simply brand our faith as ""ignorant"" or ""obscurantist""? I would say: ""do you think Pascal or C.S. Lewis, Aquinas or Simone Weil are idiots? Do you think, we, in the West, stand on the shoulders of bigoted fools, all of them?""

I thought this made for a really strong case, at the very least, for the ""weight"" of the Christian outlook. At least, this is what always made me uneasy about my own triumphalist attitude towards the past. But maybe this simply is a question of humility? Dare I say of supernatural humility?

It seems the light of Christ feels like darkness to most.",Catholicism,"""Coming out"" as Catholic among secular/atheistic friends and family. What I did not expect:",1086.0,0.93
Defense-of-Sanity,0.0,1088.0,,Catholicism,I made this infographic showing the connection between Mary and the Ark of the Covenant. Let me know what you think!,1088.0,0.98
DHA1999,0.0,1078.0,,Catholicism,"On a day like today, 489 years ago, our Lady of Guadalupe appeared in Mexican lands to San Juan Diego. Empress of the Americas, intercede for us.",1078.0,0.98
mujwa,0.0,1077.0,,Catholicism,15th September. The Memorial of Our Lady Of Sorrows,1077.0,0.98
Irishpotato1998,0.0,1082.0,,Catholicism,My sister made this fantastic picture of the Virgin Mary,1082.0,0.96
ewheck,0.0,1077.0,"Have a great Pentecost. May the church see another 1,987.",Catholicism,"Happy 1,987th Birthday to Catholicism!",1077.0,0.98
